{
  "$jsonschema": "urn:oasis:names:specification:ubl:schema:json:ProductActivity-2",
  "UBLVersionID": "2.1",
  "ProfileID": "bpid:urn:oasis:names:draft:bpss:ubl-2-1-cpfr-product-activity-draft",
  "ID": "PA_758494",
  "CopyIndicator": false,
  "UUID": "349ABBAE-DF9D-40B4-849F-94C5FF9D1AF4",
  "IssueDate": "2005-01-10",
  "IssueTime": "12:00:01.000Z",
  "Note": "sample Document",
  "ActivityPeriod": {
    "StartDate": "2005-02-26",
    "EndDate": "2005-12-26"
  },
  "SenderParty": {
    "PartyIdentification": {
      "ID": "6903148000007"
    },
    "PartyName": {
      "Name": "Consortial"
    },
    "PostalAddress": {
      "StreetName": "Busy Street",
      "BuildingName": "Thereabouts",
      "BuildingNumber": "56A",
      "CityName": "Farthing",
      "PostalZone": "AA99 1BB",
      "CountrySubentity": "Heremouthshire",
      "AddressLine": {
        "Line": "The Roundabout"
      },
      "Country": {
        "IdentificationCode": "GB"
      }
    },
    "PartyTaxScheme": {
      "RegistrationName": "Farthing Purchasing Consortium",
      "CompanyID": "175 269 2355",
      "ExemptionReason": "N/A",
      "TaxScheme": {
        "ID": "VAT",
        "TaxTypeCode": "VAT"
      }
    },
    "Contact": {
      "Name": "Mrs Bouquet",
      "Telephone": "0158 1233714",
      "Telefax": "0158 1233856",
      "ElectronicMail": "bouquet@fpconsortial.co.uk"
    }
  },
  "ReceiverParty": {
    "PartyIdentification": {
      "ID": "2203148000007"
    },
    "PartyName": {
      "Name": "IYT Corporation"
    },
    "PostalAddress": {
      "StreetName": "Avon Way",
      "BuildingName": "Thereabouts",
      "BuildingNumber": "56A",
      "CityName": "Bridgtow",
      "PostalZone": "ZZ99 1ZZ",
      "CountrySubentity": "Avon",
      "AddressLine": {
        "Line": "3rd Floor, Room 5"
      },
      "Country": {
        "IdentificationCode": "GB"
      }
    },
    "PartyTaxScheme": {
      "RegistrationName": "Bridgtow District Council",
      "CompanyID": "12356478",
      "ExemptionReason": "Local Authority",
      "TaxScheme": {
        "ID": "UK VAT",
        "TaxTypeCode": "VAT"
      }
    },
    "Contact": {
      "Name": "Mr Fred Churchill",
      "Telephone": "0127 2653214",
      "Telefax": "0127 2653215",
      "ElectronicMail": "fred@iytcorporation.gov.uk"
    }
  },
  "SupplyChainActivityDataLine": {
    "ID": "SCADL_SHIPMENT001",
    "SupplyChainActivityTypeCode": "SHIPMENTS",
    "BuyerCustomerParty": {
      "Party": {
        "PartyIdentification": {
          "ID": "2203148000007"
        }
      }
    },
    "SellerSupplierParty": {
      "Party": {
        "PartyIdentification": {
          "ID": "6903148000007"
        }
      }
    },
    "ActivityOriginLocation": {
      "ID": "1234567890"
    },
    "SalesItem": {
      "Quantity": {
        "value": 20,
        "unitCode": "KGM"
      },
      "Item": {
        "StandardItemIdentification": {
          "ID": "06110123456784"
        }
      }
    }
  }
}
