{
  "$jsonschema": "urn:oasis:names:specification:ubl:schema:json:ProductActivity-2",
  "UBLVersionID": "2.1",
  "ID": "ID0113",
  "CopyIndicator": false,
  "IssueDate": "2010-04-08",
  "Note": "Report about sales of goods in Beta Shop's shops located in Bologna.",
  "ActivityPeriod": {
    "StartDate": "2010-04-07"
  },
  "SenderParty": {
    "PartyName": {
      "Name": "Beta Shop"
    },
    "PostalAddress": {
      "StreetName": "Via Emilia",
      "BuildingNumber": "1",
      "CityName": "Modena",
      "PostalZone": "41121",
      "Country": {
        "IdentificationCode": "IT",
        "Name": "Italy"
      }
    },
    "Contact": {
      "Name": "Mr Delta",
      "Telephone": "0039 059 33000000",
      "Telefax": "0039 059 33000055",
      "ElectronicMail": "delta@betashop.it"
    }
  },
  "ReceiverParty": {
    "PartyName": {
      "Name": "Arancio Forniture spa"
    },
    "PostalAddress": {
      "Floor": "5",
      "Room": "29",
      "StreetName": "Via Dell'Arcoveggio",
      "BuildingNumber": "403",
      "Department": "Marketing Office",
      "CityName": "Bologna",
      "PostalZone": "40129",
      "Country": {
        "IdentificationCode": "IT",
        "Name": "Italy"
      }
    },
    "Contact": {
      "Name": "Mr Rossi",
      "Telephone": "0039 051 23000000",
      "Telefax": "0039 051 23000023",
      "ElectronicMail": "rossi@arancioforniture.it"
    }
  },
  "SupplyChainActivityDataLine": {
    "ID": "1",
    "SupplyChainActivityTypeCode": "SALES",
    "ActivityOriginLocation": {
      "Description": "Shop in the city center",
      "Address": {
        "StreetName": "Via Rizzoli",
        "BuildingNumber": "208",
        "CityName": "Bologna",
        "PostalZone": "40121",
        "Country": {
          "IdentificationCode": "IT",
          "Name": "Italy"
        }
      }
    },
    "SalesItem": [
      {
        "Quantity": {
          "value": 8,
          "unitCode": "NAR"
        },
        "Item": {
          "Description": "shirt",
          "BuyersItemIdentification": {
            "ID": "SH009"
          },
          "SellersItemIdentification": {
            "ID": "DD88"
          }
        }
      },
      {
        "Quantity": {
          "value": 3,
          "unitCode": "NAR"
        },
        "Item": {
          "Description": "trousers",
          "BuyersItemIdentification": {
            "ID": "TH009"
          },
          "SellersItemIdentification": {
            "ID": "DA008"
          }
        }
      }
    ]
  }
}
